{
  "approximate": true,
  "channels": {
    "brow_furrow": [
      0.0767,
      0.1533,
      0.23,
      0.3067,
      0.3833,
      0.46,
      0.46,
      0.46,
      0.46,
      0.46,
      0.46,
      0.46,
      0.46,
      0.46,
      0.46,
      0.46,
      0.46,
      0.46,
      0.46,
      0.46,
      0.46,
      0.46,
      0.46,
      0.46,
      0.46,
      0.46,
      0.46,
      0.46,
      0.46,
      0.46,
      0.46,
      0.46,
      0.46,
      0.46,
      0.46,
      0.46,
      0.46,
      0.46,
      0.46,
      0.46,
      0.46,
      0.46,
      0.46,
      0.46,
      0.46,
      0.46,
      0.46,
      0.46,
      0.46,
      0.46,
      0.46,
      0.46,
      0.46,
      0.46,
      0.46,
      0.46,
      0.46,
      0.46,
      0.46,
      0.46,
      0.46,
      0.46,
      0.46,
      0.46,
      0.46,
      0.46,
      0.46,
      0.46,
      0.46,
      0.46,
      0.46,
      0.46,
      0.46,
      0.46,
      0.46,
      0.46,
      0.46,
      0.46,
      0.46,
      0.46,
      0.46,
      0.46,
      0.46,
      0.46,
      0.46,
      0.46,
      0.46,
      0.46,
      0.46,
      0.46,
      0.46,
      0.46,
      0.46,
      0.46,
      0.46,
      0.46,
      0.46,
      0.46,
      0.46,
      0.46,
      0.46,
      0.46,
      0.46,
      0.46,
      0.46,
      0.46,
      0.46,
      0.46,
      0.46,
      0.46,
      0.46,
      0.46,
      0.3833,
      0.3067,
      0.23,
      0.1533,
      0.0767
    ],
    "jaw_open": [
      0.0084,
      0.1342,
      0.1218,
      0.121,
      0.0901,
      0.0774,
      0.3615,
      0.3839,
      0.4599,
      0.5629,
      0.0915,
      0.0981,
      0.0827,
      0.3651,
      0.0832,
      0.0128,
      0.0149,
      0.3179,
      0.3635,
      0.3701,
      0.1383,
      0.1553,
      0.1758,
      0.1008,
      0.0893,
      0.0754,
      0.1835,
      0.2858,
      0.3697,
      0.0803,
      0.1231,
      0.0738,
      0.1748,
      0.2867,
      0.2,
      0.1193,
      0.0992,
      0.1281,
      0.1685,
      0.2402,
      0.192,
      0.1724,
      0.2091,
      0.2839,
      0.2484,
      0.0614,
      0.0727,
      0.0856,
      0.1002,
      0.0999,
      0.0777,
      0.0985,
      0.3104,
      0.3089,
      0.3083,
      0.007,
      0.3083,
      0.3084,
      0.3083,
      0.3083,
      0.0525,
      0.0526,
      0.0701,
      0.0853,
      0.3882,
      0.5157,
      0.6816,
      0.6296,
      0.0086,
      0.1431,
      0.1424,
      0.0775,
      0.1298,
      0.1855,
      0.1605,
      0.2164,
      0.1864,
      0.1683,
      0.2378,
      0.1307,
      0.0961,
      0.093,
      0.1345,
      0.2048,
      0.1724,
      0.0488,
      0.0647,
      0.3275,
      0.2462,
      0.1463,
      0.1665,
      0.1219,
      0.1011,
      0.2297,
      0.2161,
      0.1293,
      0.1564,
      0.2551,
      0.2748,
      0.3395,
      0.2451,
      0.1366,
      0.1349,
      0.322,
      0.0077,
      0.0106,
      0.2792,
      0.3427,
      0.1434,
      0.1444,
      0.2456,
      0.759,
      0.6539,
      0.4964,
      0.3319,
      0.1049,
      0.1001
    ],
    "lip_press": [
      0.95,
      0.0,
      0.0,
      0.0,
      0.1,
      0.1,
      0.0,
      0.0,
      0.0,
      0.0,
      0.1,
      0.1,
      0.1,
      0.0,
      0.0,
      0.95,
      0.95,
      0.0,
      0.0,
      0.0,
      0.0,
      0.04,
      0.04,
      0.0,
      0.0,
      0.0,
      0.0,
      0.0,
      0.0,
      0.55,
      0.55,
      0.55,
      0.0,
      0.0,
      0.0,
      0.0,
      0.0,
      0.1,
      0.1,
      0.0,
      0.0,
      0.0,
      0.0,
      0.0,
      0.0,
      0.55,
      0.0,
      0.0,
      0.0,
      0.1,
      0.1,
      0.04,
      0.0,
      0.0,
      0.0,
      0.95,
      0.0,
      0.0,
      0.0,
      0.0,
      0.1,
      0.1,
      0.0,
      0.0,
      0.0,
      0.0,
      0.0,
      0.0,
      0.95,
      0.0,
      0.0,
      0.0,
      0.0,
      0.04,
      0.04,
      0.0,
      0.0,
      0.0,
      0.0,
      0.0,
      0.0,
      0.0,
      0.04,
      0.0,
      0.0,
      0.55,
      0.55,
      0.0,
      0.0,
      0.04,
      0.04,
      0.1,
      0.1,
      0.0,
      0.0,
      0.04,
      0.04,
      0.04,
      0.04,
      0.0,
      0.0,
      0.04,
      0.04,
      0.0,
      0.95,
      0.95,
      0.0,
      0.0,
      0.1,
      0.1,
      0.04,
      0.0,
      0.0,
      0.0,
      0.0,
      0.04,
      0.04
    ],
    "lip_round": [
      0.04,
      0.0,
      0.0,
      0.0,
      0.56,
      0.56,
      0.0,
      0.0,
      0.0,
      0.0,
      0.0,
      0.0,
      0.0,
      0.0,
      0.0,
      0.04,
      0.04,
      0.0,
      0.0,
      0.0,
      0.0,
      0.0,
      0.0,
      0.0,
      0.0,
      0.0,
      0.0,
      0.0,
      0.0,
      0.0,
      0.0,
      0.0,
      0.0,
      0.0,
      0.88,
      0.88,
      0.88,
      0.56,
      0.56,
      0.0,
      0.0,
      0.0,
      0.0,
      0.0,
      0.0,
      0.0,
      0.0,
      0.0,
      0.0,
      0.56,
      0.56,
      0.0,
      0.0,
      0.0,
      0.0,
      0.04,
      0.0,
      0.0,
      0.0,
      0.0,
      0.0,
      0.0,
      0.0,
      0.0,
      0.0,
      0.0,
      0.0,
      0.0,
      0.04,
      0.0,
      0.0,
      0.0,
      0.0,
      0.0,
      0.0,
      0.0,
      0.0,
      0.0,
      0.0,
      0.88,
      0.88,
      0.88,
      0.0,
      0.0,
      0.0,
      0.0,
      0.0,
      0.0,
      0.0,
      0.0,
      0.0,
      0.0,
      0.0,
      0.0,
      0.0,
      0.0,
      0.0,
      0.0,
      0.0,
      0.0,
      0.0,
      0.0,
      0.0,
      0.0,
      0.04,
      0.04,
      0.0,
      0.0,
      0.0,
      0.0,
      0.0,
      0.0,
      0.0,
      0.0,
      0.0,
      0.0,
      0.0
    ],
    "lip_wide": [
      0.0,
      0.82,
      0.82,
      0.82,
      0.04,
      0.04,
      0.22,
      0.22,
      0.22,
      0.22,
      0.66,
      0.66,
      0.66,
      0.22,
      0.82,
      0.0,
      0.0,
      0.56,
      0.56,
      0.56,
      0.18,
      0.34,
      0.34,
      0.82,
      0.82,
      0.82,
      0.56,
      0.56,
      0.56,
      0.3,
      0.3,
      0.3,
      0.18,
      0.18,
      0.0,
      0.0,
      0.0,
      0.04,
      0.04,
      0.56,
      0.56,
      0.18,
      0.18,
      0.56,
      0.56,
      0.3,
      0.82,
      0.82,
      0.82,
      0.04,
      0.04,
      0.34,
      0.22,
      0.22,
      0.22,
      0.0,
      0.22,
      0.22,
      0.22,
      0.22,
      0.66,
      0.66,
      0.82,
      0.82,
      0.22,
      0.22,
      0.22,
      0.22,
      0.0,
      0.18,
      0.18,
      0.82,
      0.82,
      0.34,
      0.34,
      0.56,
      0.56,
      0.18,
      0.18,
      0.0,
      0.0,
      0.0,
      0.34,
      0.56,
      0.56,
      0.3,
      0.3,
      0.56,
      0.56,
      0.34,
      0.34,
      0.66,
      0.66,
      0.56,
      0.56,
      0.34,
      0.34,
      0.34,
      0.34,
      0.56,
      0.56,
      0.34,
      0.34,
      0.22,
      0.0,
      0.0,
      0.56,
      0.56,
      0.66,
      0.66,
      0.34,
      0.22,
      0.22,
      0.22,
      0.22,
      0.34,
      0.34
    ],
    "squint": [
      0.0367,
      0.0733,
      0.11,
      0.1467,
      0.1833,
      0.22,
      0.22,
      0.22,
      0.22,
      0.22,
      0.22,
      0.22,
      0.22,
      0.22,
      0.22,
      0.22,
      0.22,
      0.22,
      0.22,
      0.22,
      0.22,
      0.22,
      0.22,
      0.22,
      0.22,
      0.22,
      0.22,
      0.22,
      0.22,
      0.22,
      0.22,
      0.22,
      0.22,
      0.22,
      0.22,
      0.22,
      0.22,
      0.22,
      0.22,
      0.22,
      0.22,
      0.22,
      0.22,
      0.22,
      0.22,
      0.22,
      0.22,
      0.22,
      0.22,
      0.22,
      0.22,
      0.22,
      0.22,
      0.22,
      0.22,
      0.22,
      0.22,
      0.22,
      0.22,
      0.22,
      0.22,
      0.22,
      0.22,
      0.22,
      0.22,
      0.22,
      0.22,
      0.22,
      0.22,
      0.22,
      0.22,
      0.22,
      0.22,
      0.22,
      0.22,
      0.22,
      0.22,
      0.22,
      0.22,
      0.22,
      0.22,
      0.22,
      0.22,
      0.22,
      0.22,
      0.22,
      0.22,
      0.22,
      0.22,
      0.22,
      0.22,
      0.22,
      0.22,
      0.22,
      0.22,
      0.22,
      0.22,
      0.22,
      0.22,
      0.22,
      0.22,
      0.22,
      0.22,
      0.22,
      0.22,
      0.22,
      0.22,
      0.22,
      0.22,
      0.22,
      0.22,
      0.22,
      0.1833,
      0.1467,
      0.11,
      0.0733,
      0.0367
    ]
  },
  "emotion": "grave",
  "fps": 24,
  "frame_count": 117,
  "line_id": "s06_command_1",
  "profile": "smooth",
  "schema_version": 1
}
